Завтрак;Овсянная каша;150;.\images\овсяная каша.jpg;Ингредиенты: Овёс, молоко/вода, соль/сахар, масло.
Завтрак;Рисовая Каша;60;.\\images\\рисовая каша.jpg;Ингредиенты: Рис, молоко/вода, соль/сахар, масло.
Завтрак;Манная Каша;100;.\\images\\манная каша.jpg;Ингредиенты: Манная крупа, молоко, сахар, масло.
Обед;Борщ;200;.\\images\\борщ.jpg;Ингредиенты: Свёкла, капуста, картофель, морковь, лук, мясо/бульон, томат, сметана.
Обед;Рассольник;100;.\\images\\рассольник.jpg;Ингредиенты: Солёные огурцы, перловка, картофель, морковь, лук, мясо/бульон, сметана.
Обед;Окрошка;150;.\\images\\окрошка.jpg;Ингредиенты: Варёные овощи (картофель, морковь), колбаса/мясо, яйца, огурцы, зелёный лук.
Ужин;Плов;150;.\\images\\плов.jpg;Ингредиенты: Рис, мясо (чаще баранина), морковь, лук, масло, специи.
Ужин;Овощной салат;100;.\\images\\овощной салат.jpg;Ингредиенты: Свежие овощи (огурцы, помидоры, перец и др.), зелень, масло/сметана.
Ужин;Картофельное пюре;50;.\\images\\картофельное пюре.jpg;Ингредиенты: Картофель, молоко, масло, соль.